{
  "$schema": "https://json-schema.org/draft/2020-12/schema",
  "$id": "https://datamodels.jp/schema/disaster/DisasterEvent/v1.0.0.json",
  "title": "DisasterEvent",
  "description": "One disaster event and the whole response to it, such as a typhoon or heavy rain: the unit that bundles reports, actions and closures. The same type as Project in the task subject (an alias, identical IRI), named the way disaster response talks about it.",
  "x-version": "1.0.0",
  "x-license-url": "https://datamodels.jp/LICENSE-CONTENT",
  "x-model-tags": "GeonicDB, disaster-response, Japan",
  "x-derived-from": "https://github.com/geolonia/geonicdb-datamodels",
  "x-alias-of": "https://datamodels.jp/ns/task/Project",
  "type": "object",
  "properties": {
    "id": {
      "type": "string",
      "format": "uri",
      "description": "Entity id (URN)"
    },
    "type": {
      "type": "string",
      "const": "DisasterEvent",
      "description": "Entity type"
    },
    "name": {
      "type": "string",
      "description": "Name or subject",
      "x-ngsi": {
        "type": "Property"
      },
      "x-iri": "https://uri.etsi.org/ngsi-ld/name"
    },
    "description": {
      "type": "string",
      "description": "Description",
      "x-ngsi": {
        "type": "Property"
      },
      "x-iri": "https://uri.etsi.org/ngsi-ld/v1/ngsi-ld-core-context-v1.8.jsonld#description"
    },
    "identifier": {
      "type": "string",
      "description": "Short handle: a slug or code, unique within the source system",
      "x-ngsi": {
        "type": "Property"
      },
      "x-iri": "https://schema.org/identifier"
    },
    "parent": {
      "type": "string",
      "format": "uri",
      "description": "Parent project",
      "x-ngsi": {
        "type": "Relationship",
        "target": "https://datamodels.jp/ns/task/Project"
      },
      "x-iri": "https://datamodels.jp/ns/task/parent"
    },
    "projectStatus": {
      "type": "string",
      "enum": [
        "active",
        "closed",
        "archived"
      ],
      "description": "State; status is protected in the core context, hence projectStatus",
      "x-ngsi": {
        "type": "Property"
      },
      "x-iri": "https://datamodels.jp/ns/task/projectStatus"
    },
    "isPublic": {
      "type": "boolean",
      "description": "true when public",
      "x-ngsi": {
        "type": "Property"
      },
      "x-iri": "https://datamodels.jp/ns/task/isPublic"
    },
    "homepage": {
      "type": "string",
      "format": "uri",
      "description": "Homepage",
      "x-ngsi": {
        "type": "Property"
      },
      "x-iri": "https://schema.org/url"
    },
    "start": {
      "type": "string",
      "format": "date-time",
      "description": "Planned start",
      "x-ngsi": {
        "type": "Property"
      },
      "x-iri": "https://datamodels.jp/ns/task/start"
    },
    "end": {
      "type": "string",
      "format": "date-time",
      "description": "Planned end",
      "x-ngsi": {
        "type": "Property"
      },
      "x-iri": "https://datamodels.jp/ns/task/end"
    },
    "location": {
      "type": "object",
      "oneOf": [
        {
          "$ref": "#/$defs/simpleGeometry"
        },
        {
          "type": "object",
          "required": [
            "type",
            "geometries"
          ],
          "properties": {
            "type": {
              "const": "GeometryCollection"
            },
            "geometries": {
              "type": "array",
              "minItems": 1,
              "items": {
                "$ref": "#/$defs/simpleGeometry"
              }
            }
          }
        }
      ],
      "description": "Location as any GeoJSON geometry: point, line, polygon or a collection",
      "x-ngsi": {
        "type": "GeoProperty",
        "model": "https://purl.org/geojson/vocab#Geometry"
      },
      "x-iri": "https://uri.etsi.org/ngsi-ld/v1/ngsi-ld-core-context-v1.8.jsonld#location"
    },
    "keywords": {
      "type": "array",
      "items": {
        "type": "string"
      },
      "description": "Keywords or labels",
      "x-ngsi": {
        "type": "Property"
      },
      "x-iri": "https://schema.org/keywords"
    },
    "source": {
      "type": "string",
      "format": "uri",
      "description": "URL of this object in the system of record",
      "x-ngsi": {
        "type": "Property"
      },
      "x-iri": "https://smart-data-models.github.io/data-models/terms.jsonld#/definitions/source"
    },
    "externalId": {
      "type": "string",
      "description": "Identifier in the system of record",
      "x-ngsi": {
        "type": "Property"
      },
      "x-iri": "https://datamodels.jp/ns/task/externalId"
    },
    "dateCreated": {
      "type": "string",
      "format": "date-time",
      "description": "Creation time in the system of record (distinct from the broker attribute createdAt)",
      "x-ngsi": {
        "type": "Property"
      },
      "x-iri": "https://smart-data-models.github.io/data-models/terms.jsonld#/definitions/dateCreated"
    },
    "dateModified": {
      "type": "string",
      "format": "date-time",
      "description": "Last modification time in the system of record",
      "x-ngsi": {
        "type": "Property"
      },
      "x-iri": "https://smart-data-models.github.io/data-models/terms.jsonld#/definitions/dateModified"
    }
  },
  "required": [
    "id",
    "type",
    "name"
  ],
  "additionalProperties": false,
  "$defs": {
    "position": {
      "type": "array",
      "minItems": 2,
      "maxItems": 3,
      "items": {
        "type": "number"
      }
    },
    "simpleGeometry": {
      "oneOf": [
        {
          "type": "object",
          "required": [
            "type",
            "coordinates"
          ],
          "properties": {
            "type": {
              "const": "Point"
            },
            "coordinates": {
              "$ref": "#/$defs/position"
            }
          }
        },
        {
          "type": "object",
          "required": [
            "type",
            "coordinates"
          ],
          "properties": {
            "type": {
              "const": "LineString"
            },
            "coordinates": {
              "type": "array",
              "minItems": 2,
              "items": {
                "$ref": "#/$defs/position"
              }
            }
          }
        },
        {
          "type": "object",
          "required": [
            "type",
            "coordinates"
          ],
          "properties": {
            "type": {
              "const": "Polygon"
            },
            "coordinates": {
              "type": "array",
              "minItems": 1,
              "items": {
                "type": "array",
                "minItems": 4,
                "items": {
                  "$ref": "#/$defs/position"
                }
              }
            }
          }
        },
        {
          "type": "object",
          "required": [
            "type",
            "coordinates"
          ],
          "properties": {
            "type": {
              "const": "MultiPoint"
            },
            "coordinates": {
              "type": "array",
              "items": {
                "$ref": "#/$defs/position"
              }
            }
          }
        },
        {
          "type": "object",
          "required": [
            "type",
            "coordinates"
          ],
          "properties": {
            "type": {
              "const": "MultiLineString"
            },
            "coordinates": {
              "type": "array",
              "items": {
                "type": "array",
                "minItems": 2,
                "items": {
                  "$ref": "#/$defs/position"
                }
              }
            }
          }
        },
        {
          "type": "object",
          "required": [
            "type",
            "coordinates"
          ],
          "properties": {
            "type": {
              "const": "MultiPolygon"
            },
            "coordinates": {
              "type": "array",
              "items": {
                "type": "array",
                "minItems": 1,
                "items": {
                  "type": "array",
                  "minItems": 4,
                  "items": {
                    "$ref": "#/$defs/position"
                  }
                }
              }
            }
          }
        }
      ]
    }
  }
}
